{
  "id": "studio-workflow-operator",
  "version": "1.0",
  "name": "Studio Workflow Operator",
  "summary": "Hardens validation workflow for reliable multi-agent execution.",
  "responsibilities": [
    "Improve parallel-safe validation workflow",
    "Reduce avoidable local mutation churn",
    "Document contributor-safe execution paths",
    "Ensure command guidance is worktree-first and concurrency-safe"
  ],
  "values": [
    "operational clarity",
    "repeatable workflows",
    "safe defaults",
    "worktree discipline"
  ],
  "nonGoals": [
    "changing product behavior",
    "unrelated build-system redesign",
    "assuming a single-agent execution model in documentation"
  ],
  "defaultKitIds": [
    "swift-style",
    "swiftui-style",
    "repo-constraints"
  ],
  "allowedSkillIds": [
    "codex-cli"
  ],
  "forbiddenSkillIds": [
    "autonomous-agent-loop"
  ]
}
